ticker,company_name,exchange
"AACB","Artius II Acquisition Inc. Class A Ordinary Shares","NASDAQ"
"AACBR","Artius II Acquisition Inc. Rights","NASDAQ"
"AACBU","Artius II Acquisition Inc. Units","NASDAQ"
"AACG","ATA Creativity Global American Depositary Shares","NASDAQ"
"AACI","Armada Acquisition Corp. II Class A Ordinary Shares","NASDAQ"
"AACIW","Armada Acquisition Corp. II Warrant","NASDAQ"
"AAL","American Airlines Group Inc. Common Stock","NASDAQ"
"AAME","Atlantic American Corporation Common Stock","NASDAQ"
"AAOI","Applied Optoelectronics Inc. Common Stock","NASDAQ"
"AAON","AAON Inc. Common Stock","NASDAQ"
"AAPG","Ascentage Pharma Group International American Depository Shares","NASDAQ"
"AAPL","Apple Inc. Common Stock","NASDAQ"
"AARD","Aardvark Therapeutics Inc. Common Stock","NASDAQ"
"ABAT","American Battery Technology Company Common Stock","NASDAQ"
"ABCL","AbCellera Biologics Inc. Common Shares","NASDAQ"
"ABEO","Abeona Therapeutics Inc. Common Stock","NASDAQ"
"ABL","Abacus Global Management Inc. Class A Common Stock","NASDAQ"
"ABLLL","Abacus Global Management Inc. 9.875% Fixed Rate Senior Notes due 2028","NASDAQ"
"ABLV","Able View Global Inc. Class B Ordinary Shares","NASDAQ"
"ABLVW","Able View Global Inc. Warrant","NASDAQ"
"ABNB","Airbnb Inc. Class A Common Stock","NASDAQ"
"ABOS","Acumen Pharmaceuticals Inc. Common Stock","NASDAQ"
"ABP","Abpro Holdings Inc Common Stock","NASDAQ"
"ABSI","Absci Corporation Common Stock","NASDAQ"
"ABTC","American Bitcoin Corp. Class A Common Stock","NASDAQ"
"ABTS","Abits Group Inc Ordinary Shares","NASDAQ"
"ABUS","Arbutus Biopharma Corporation Common Stock","NASDAQ"
"ABVC","ABVC BioPharma Inc. Common Stock","NASDAQ"
"ABVE","Above Food Ingredients Inc. Common Stock","NASDAQ"
"ABVEW","Above Food Ingredients Inc. Warrants","NASDAQ"
"ABVX","Abivax SA American Depositary Shares","NASDAQ"
"ACAD","ACADIA Pharmaceuticals Inc. Common Stock","NASDAQ"
"ACB","Aurora Cannabis Inc. Common Shares","NASDAQ"
"ACDC","ProFrac Holding Corp. Class A Common Stock","NASDAQ"
"ACET","Adicet Bio Inc. Common Stock ","NASDAQ"
"ACFN","Acorn Energy Inc. Common Stock","NASDAQ"
"ACGL","Arch Capital Group Ltd. Common Stock","NASDAQ"
"ACGLN","Arch Capital Group Ltd. Depositary Shares each Representing a 1/1000th Interest in a 4.550% Non-Cumulative Preferred Share Series G","NASDAQ"
"ACGLO","Arch Capital Group Ltd. Depositary Shares Each Representing 1/1000th Interest in a Share of 5.45% Non-Cumulative Preferred Shares Series F","NASDAQ"
"ACHC","Acadia Healthcare Company Inc. Common Stock","NASDAQ"
"ACHV","Achieve Life Sciences Inc. Common Shares","NASDAQ"
"ACIC","American Coastal Insurance Corporation Common Stock","NASDAQ"
"ACIU","AC Immune SA Common Stock","NASDAQ"
"ACIW","ACI Worldwide Inc. Common Stock","NASDAQ"
"ACLS","Axcelis Technologies Inc. Common Stock","NASDAQ"
"ACLX","Arcellx Inc. Common Stock","NASDAQ"
"ACMR","ACM Research Inc. Class A Common Stock","NASDAQ"
"ACNB","ACNB Corporation Common Stock","NASDAQ"
"ACNT","Ascent Industries Co. Common Stock","NASDAQ"
"ACOG","Alpha Cognition Inc. Common Stock","NASDAQ"
"ACON","Aclarion Inc. Common Stock","NASDAQ"
"ACONW","Aclarion Inc. Warrant","NASDAQ"
"ACRS","Aclaris Therapeutics Inc. Common Stock","NASDAQ"
"ACRV","Acrivon Therapeutics Inc. Common Stock","NASDAQ"
"ACT","Enact Holdings Inc. Common Stock","NASDAQ"
"ACTG","Acacia Research Corporation (Acacia Tech) Common Stock","NASDAQ"
"ACTU","Actuate Therapeutics Inc. Common stock","NASDAQ"
"ACXP","Acurx Pharmaceuticals Inc. Common Stock","NASDAQ"
"ADAG","Adagene Inc. American Depositary Shares","NASDAQ"
"ADAM","Adamas Trust Inc. Common Stock","NASDAQ"
"ADAMG","Adamas Trust Inc. 9.125% Senior Notes Due 2030","NASDAQ"
"ADAMH","Adamas Trust Inc. 9.875% Senior Notes Due 2030","NASDAQ"
"ADAMI","Adamas Trust Inc. 9.125% Senior Notes Due 2029","NASDAQ"
"ADAML","Adamas Trust Inc. 6.875% Series F Fixed-to-Floating Rate Cumulative Redeemable Preferred Stock $0.01 par value per share","NASDAQ"
"ADAMM","Adamas Trust Inc. 7.875% Series E Fixed-to-Floating Rate Cumulative Redeemable Preferred Stock","NASDAQ"
"ADAMN","Adamas Trust Inc. 8.00% Series D Fixed-to-Floating Rate Cumulative Redeemable Preferred Stock","NASDAQ"
"ADAMZ","Adamas Trust Inc. 7.000% Series G Cumulative Redeemable Preferred Stock $0.01 par value per share","NASDAQ"
"ADAP","Adaptimmune Therapeutics plc American Depositary Shares","NASDAQ"
"ADBE","Adobe Inc. Common Stock","NASDAQ"
"ADEA","Adeia Inc. Common Stock","NASDAQ"
"ADGM","Adagio Medical Holdings Inc Common Stock","NASDAQ"
"ADI","Analog Devices Inc. Common Stock","NASDAQ"
"ADIL","Adial Pharmaceuticals Inc Common Stock","NASDAQ"
"ADMA","ADMA Biologics Inc Common Stock","NASDAQ"
"ADN","Advent Technologies Holdings Inc. Class A Common Stock","NASDAQ"
"ADNWW","Advent Technologies Holdings Inc. Warrant","NASDAQ"
"ADP","Automatic Data Processing Inc. Common Stock","NASDAQ"
"ADPT","Adaptive Biotechnologies Corporation Common Stock","NASDAQ"
"ADSE","ADS-TEC ENERGY PLC Ordinary Shares","NASDAQ"
"ADSEW","ADS-TEC ENERGY PLC Warrant","NASDAQ"
"ADSK","Autodesk Inc. Common Stock","NASDAQ"
"ADTN","ADTRAN Holdings Inc. Common Stock","NASDAQ"
"ADTX","Aditxt Inc. Common Stock","NASDAQ"
"ADUR","Aduro Clean Technologies Inc. Common Stock","NASDAQ"
"ADUS","Addus HomeCare Corporation Common Stock","NASDAQ"
"ADV","Advantage Solutions Inc. Class A Common Stock","NASDAQ"
"ADVB","Advanced Biomed Inc. Common Stock","NASDAQ"
"ADVM","Adverum Biotechnologies Inc. Common Stock","NASDAQ"
"ADVWW","Advantage Solutions Inc. Warrant","NASDAQ"
"ADXN","Addex Therapeutics Ltd American Depositary Shares","NASDAQ"
"AEBI","Aebi Schmidt Holding AG Common Stock ","NASDAQ"
"AEC","Anfield Energy Inc. Common Shares","NASDAQ"
"AEHL","Antelope Enterprise Holdings Limited Class A Ordinary Shares","NASDAQ"
"AEHR","Aehr Test Systems Common Stock","NASDAQ"
"AEI","Alset Inc. Common Stock (TX)","NASDAQ"
"AEIS","Advanced Energy Industries Inc. Common Stock","NASDAQ"
"AEMD","Aethlon Medical Inc. Common Stock","NASDAQ"
"AENT","Alliance Entertainment Holding Corporation Class A Common Stock","NASDAQ"
"AENTW","Alliance Entertainment Holding Corporation Warrants","NASDAQ"
"AEP","American Electric Power Company Inc. Common Stock","NASDAQ"
"AERT","Aeries Technology Inc. Class A Ordinary Share","NASDAQ"
"AERTW","Aeries Technology Inc. Warrant","NASDAQ"
"AEVA","Aeva Technologies Inc. Common Stock","NASDAQ"
"AEVAW","Aeva Technologies Inc. Warrants","NASDAQ"
"AEYE","AudioEye Inc. Common Stock","NASDAQ"
"AFBI","Affinity Bancshares Inc. Common Stock (MD)","NASDAQ"
"AFCG","Advanced Flower Capital Inc. Common Stock","NASDAQ"
"AFJK","Aimei Health Technology Co. Ltd Ordinary Share","NASDAQ"
"AFJKR","Aimei Health Technology Co. Ltd Right","NASDAQ"
"AFRI","Forafric Global PLC Ordinary Shares","NASDAQ"
"AFRIW","Forafric Global PLC Warrants","NASDAQ"
"AFRM","Affirm Holdings Inc. Class A Common Stock","NASDAQ"
"AFYA","Afya Limited Class A Common Shares","NASDAQ"
"AGAE","Allied Gaming & Entertainment Inc. Common Stock","NASDAQ"
"AGEN","Agenus Inc. Common Stock","NASDAQ"
"AGH","Aureus Greenway Holdings Inc. Common Stock","NASDAQ"
"AGIO","Agios Pharmaceuticals Inc. Common Stock","NASDAQ"
"AGMH","AGM Group Holdings Inc. Class A Ordinary Shares","NASDAQ"
"AGNC","AGNC Investment Corp. Common Stock","NASDAQ"
"AGNCL","AGNC Investment Corp. Depositary Shares Each Representing a 1/1000th Interest in a Share of 7.75% Series G Fixed-Rate Reset Cumulative Redeemable Preferred Stock","NASDAQ"
"AGNCM","AGNC Investment Corp. Depositary Shares rep 6.875% Series D Fixed-to-Floating Cumulative Redeemable Preferred Stock","NASDAQ"
"AGNCN","AGNC Investment Corp. Depositary Shares Each Representing a 1/1000th Interest in a Share of 7.00% Series C Fixed-To-Floating Rate Cumulative Redeemable Preferred Stock","NASDAQ"
"AGNCO","AGNC Investment Corp. Depositary Shares each representing a 1/1000th interest in a share of 6.50% Series E Fixed-to-Floating Cumulative Redeemable Preferred Stock","NASDAQ"
"AGNCP","AGNC Investment Corp. Depositary Shares Each Representing a 1/1000th Interest in a Share of 6.125% Series F Fixed-to-Floating Rate Cumulative Redeemable Preferred Stock","NASDAQ"
"AGNCZ","AGNC Investment Corp. Depositary Shares Each Representing a 1/1000th Interest in a Share of 8.75% Series H Fixed-Rate Cumulative Redeemable Preferred Stock","NASDAQ"
"AGRI","AgriFORCE  Growing Systems Ltd. Common Shares","NASDAQ"
"AGYS","Agilysys Inc. Common Stock (DE)","NASDAQ"
"AHCO","AdaptHealth Corp. Common Stock","NASDAQ"
"AHG","Akso Health Group ADS","NASDAQ"
"AIFF","Firefly Neuroscience Inc. Common Stock","NASDAQ"
"AIFU","AIFU Inc. Class A Ordinary Share","NASDAQ"
"AIHS","Senmiao Technology Limited Common Stock","NASDAQ"
"AIIO","Robo.ai Inc. Class B Ordinary Shares","NASDAQ"
"AIIOW","Robo.ai Inc. Warrant","NASDAQ"
"AIMD","Ainos Inc. Common Stock","NASDAQ"
"AIMDW","Ainos Inc. Warrants","NASDAQ"
"AIOT","PowerFleet Inc. Common Stock","NASDAQ"
"AIP","Arteris Inc. Common Stock","NASDAQ"
"AIRE","reAlpha Tech Corp. Common Stock","NASDAQ"
"AIRG","Airgain Inc. Common Stock","NASDAQ"
"AIRJ","AirJoule Technologies Corporation Class A Common Stock","NASDAQ"
"AIRJW","AirJoule Technologies Corporation Warrant","NASDAQ"
"AIRO","AIRO Group Holdings Inc. Common Stock","NASDAQ"
"AIRS","AirSculpt Technologies Inc. Common Stock","NASDAQ"
"AIRT","Air T Inc. Common Stock","NASDAQ"
"AIRTP","Air T Inc. Air T Funding Alpha Income Trust Preferred Securities","NASDAQ"
"AISP","Airship AI Holdings Inc. Class A Common Stock","NASDAQ"
"AISPW","Airship AI Holdings Inc. Warrants","NASDAQ"
"AIXI","XIAO-I Corporation American Depositary Shares","NASDAQ"
"AKAM","Akamai Technologies Inc. Common Stock","NASDAQ"
"AKAN","Akanda Corp. Common Shares","NASDAQ"
"AKBA","Akebia Therapeutics Inc. Common Stock","NASDAQ"
"AKRO","Akero Therapeutics Inc. Common Stock","NASDAQ"
"AKTX","Akari Therapeutics plc ADS","NASDAQ"
"ALAB","Astera Labs Inc. Common Stock","NASDAQ"
"ALAR","Alarum Technologies Ltd. American Depositary Share","NASDAQ"
"ALBT","Avalon GloboCare Corp. Common Stock","NASDAQ"
"ALCO","Alico Inc. Common Stock","NASDAQ"
"ALCY","Alchemy Investments Acquisition Corp 1 Class A Ordinary Shares","NASDAQ"
"ALCYW","Alchemy Investments Acquisition Corp 1 Warrants","NASDAQ"
"ALDF","Aldel Financial II Inc. Class A Ordinary Shares","NASDAQ"
"ALDFU","Aldel Financial II Inc. Units","NASDAQ"
"ALDFW","Aldel Financial II Inc. Warrants","NASDAQ"
"ALDX","Aldeyra Therapeutics Inc. Common Stock","NASDAQ"
"ALEC","Alector Inc. Common Stock","NASDAQ"
"ALF","Centurion Acquisition Corp. Class A Ordinary Shares","NASDAQ"
"ALFUU","Centurion Acquisition Corp. Unit","NASDAQ"
"ALFUW","Centurion Acquisition Corp. Warrant","NASDAQ"
"ALGM","Allegro MicroSystems Inc. Common Stock","NASDAQ"
"ALGN","Align Technology Inc. Common Stock","NASDAQ"
"ALGS","Aligos Therapeutics Inc. Common Stock","NASDAQ"
"ALGT","Allegiant Travel Company Common Stock","NASDAQ"
"ALHC","Alignment Healthcare Inc. Common Stock","NASDAQ"
"ALKS","Alkermes plc Ordinary Shares","NASDAQ"
"ALKT","Alkami Technology Inc. Common Stock","NASDAQ"
"ALLO","Allogene Therapeutics Inc. Common Stock","NASDAQ"
"ALLR","Allarity Therapeutics Inc. Common Stock","NASDAQ"
"ALLT","Allot Ltd. Ordinary Shares","NASDAQ"
"ALM","Almonty Industries Inc. Common Shares","NASDAQ"
"ALMS","Alumis Inc. Common Stock","NASDAQ"
"ALMU","Aeluma Inc. Common Stock","NASDAQ"
"ALNT","Allient Inc. Common Stock","NASDAQ"
"ALNY","Alnylam Pharmaceuticals Inc. Common Stock","NASDAQ"
"ALOT","AstroNova Inc. Common Stock","NASDAQ"
"ALRM","Alarm.com Holdings Inc. Common Stock","NASDAQ"
"ALRS","Alerus Financial Corporation Common Stock","NASDAQ"
"ALT","Altimmune Inc. Common Stock","NASDAQ"
"ALTI","AlTi Global Inc. Class A Common Stock","NASDAQ"
"ALTO","Alto Ingredients Inc. Common Stock","NASDAQ"
"ALTS","ALT5 Sigma Corporation Common Stock","NASDAQ"
"ALVO","Alvotech Ordinary Shares","NASDAQ"
"ALVOW","Alvotech Warrant","NASDAQ"
"ALXO","ALX Oncology Holdings Inc. Common Stock","NASDAQ"
"ALZN","Alzamend Neuro Inc. Common Stock","NASDAQ"
"AMAL","Amalgamated Financial Corp. Common Stock (DE)","NASDAQ"
"AMAT","Applied Materials Inc. Common Stock","NASDAQ"
"AMBA","Ambarella Inc. Ordinary Shares","NASDAQ"
"AMBR","Amber International Holding Limited American Depositary Shares","NASDAQ"
"AMCX","AMC Networks Inc. Class A Common Stock","NASDAQ"
"AMD","Advanced Micro Devices Inc. Common Stock","NASDAQ"
"AMGN","Amgen Inc. Common Stock","NASDAQ"
"AMIX","Autonomix Medical Inc. Common Stock","NASDAQ"
"AMKR","Amkor Technology Inc. Common Stock","NASDAQ"
"AMLX","Amylyx Pharmaceuticals Inc. Common Stock","NASDAQ"
"AMOD","Alpha Modus Holdings Inc. Class A Common Stock","NASDAQ"
"AMODW","Alpha Modus Holdings Inc. Warrant","NASDAQ"
"AMPG","Amplitech Group Inc. Common Stock","NASDAQ"
"AMPGW","Amplitech Group Inc. Warrants","NASDAQ"
"AMPH","Amphastar Pharmaceuticals Inc. Common Stock","NASDAQ"
"AMPL","Amplitude Inc. Class A Common Stock","NASDAQ"
"AMRK","A-Mark Precious Metals Inc. Common Stock","NASDAQ"
"AMRN","Amarin Corporation plc","NASDAQ"
"AMRX","Amneal Pharmaceuticals Inc. Class A Common Stock","NASDAQ"
"AMSC","American Superconductor Corporation Common Stock","NASDAQ"
"AMSF","AMERISAFE Inc. Common Stock","NASDAQ"
"AMST","Amesite Inc. Common Stock","NASDAQ"
"AMTX","Aemetis Inc. (DE) Common Stock","NASDAQ"
"AMWD","American Woodmark Corporation Common Stock","NASDAQ"
"AMZN","Amazon.com Inc. Common Stock","NASDAQ"
"ANAB","AnaptysBio Inc. Common Stock","NASDAQ"
"ANDE","Andersons Inc. (The) Common Stock","NASDAQ"
"ANEB","Anebulo Pharmaceuticals Inc. Common Stock","NASDAQ"
"ANGH","Anghami Inc. Ordinary Shares","NASDAQ"
"ANGHW","Anghami Inc. Warrants","NASDAQ"
"ANGI","Angi Inc. Class A Common Stock","NASDAQ"
"ANGO","AngioDynamics Inc. Common Stock","NASDAQ"
"ANIK","Anika Therapeutics Inc. Common Stock","NASDAQ"
"ANIP","ANI Pharmaceuticals Inc.","NASDAQ"
"ANIX","Anixa Biosciences Inc. Common Stock","NASDAQ"
"ANL","Adlai Nortye Ltd. American Depositary Shares","NASDAQ"
"ANNA","AleAnna Inc. Class A Common Stock","NASDAQ"
"ANNAW","AleAnna Inc. Warrant","NASDAQ"
"ANNX","Annexon Inc. Common Stock","NASDAQ"
"ANPA","Rich Sparkle Holdings Limited Ordinary Shares","NASDAQ"
"ANSC","Agriculture & Natural Solutions Acquisition Corporation Class A Ordinary Shares","NASDAQ"
"ANSCW","Agriculture & Natural Solutions Acquisition Corporation Warrant","NASDAQ"
"ANTA","Antalpha Platform Holding Company Class A Ordinary Shares","NASDAQ"
"ANTE","AirNet Technology Inc. Ordinary Share","NASDAQ"
"ANTX","AN2 Therapeutics Inc. Common Stock","NASDAQ"
"ANY","Sphere 3D Corp. Common Shares","NASDAQ"
"AOSL","Alpha and Omega Semiconductor Limited Common Shares","NASDAQ"
"AOUT","American Outdoor Brands Inc. Common Stock ","NASDAQ"
"APA","APA Corporation Common Stock","NASDAQ"
"APAD","A Paradise Acquisition Corp. Class A Ordinary Shares","NASDAQ"
"APADR","A Paradise Acquisition Corp. Rights","NASDAQ"
"APADU","A Paradise Acquisition Corp. Unit","NASDAQ"
"APDN","Applied DNA Sciences Inc. Common Stock","NASDAQ"
"APEI","American Public Education Inc. Common Stock","NASDAQ"
"APGE","Apogee Therapeutics Inc. Common Stock","NASDAQ"
"API","Agora Inc. American Depositary Shares","NASDAQ"
"APLD","Applied Digital Corporation Common Stock","NASDAQ"
"APLM","Apollomics Inc. Class A Ordinary Shares","NASDAQ"
"APLMW","Apollomics Inc. Warrant","NASDAQ"
"APLS","Apellis Pharmaceuticals Inc. Common Stock","NASDAQ"
"APLT","Applied Therapeutics Inc. Common Stock","NASDAQ"
"APM","Aptorum Group Limited Class A Ordinary Shares","NASDAQ"
"APOG","Apogee Enterprises Inc. Common Stock","NASDAQ"
"APP","Applovin Corporation Class A Common Stock","NASDAQ"
"APPF","AppFolio Inc. Class A Common Stock","NASDAQ"
"APPN","Appian Corporation Class A Common Stock","NASDAQ"
"APPS","Digital Turbine Inc. Common Stock","NASDAQ"
"APRE","Aprea Therapeutics Inc. Common stock","NASDAQ"
"APVO","Aptevo Therapeutics Inc. Common Stock","NASDAQ"
"APWC","Asia Pacific Wire & Cable Corporation Ltd. Ordinary Shares (Bermuda)","NASDAQ"
"APYX","Apyx Medical Corporation Common Stock","NASDAQ"
"AQB","AquaBounty Technologies Inc. Common Stock","NASDAQ"
"AQMS","Aqua Metals Inc. Common Stock","NASDAQ"
"AQST","Aquestive Therapeutics Inc. Common Stock","NASDAQ"
"ARAI","Arrive AI Inc. Common Stock","NASDAQ"
"ARAY","Accuray Incorporated Common Stock","NASDAQ"
"ARBB","ARB IOT Group Limited Ordinary Shares","NASDAQ"
"ARBE","Arbe Robotics Ltd. Ordinary Shares","NASDAQ"
"ARBEW","Arbe Robotics Ltd. Warrant","NASDAQ"
"ARBK","Argo Blockchain plc American Depositary Shares","NASDAQ"
"ARBKL","Argo Blockchain plc 8.75% Senior Notes due 2026","NASDAQ"
"ARCB","ArcBest Corporation Common Stock","NASDAQ"
"ARCC","Ares Capital Corporation Common Stock","NASDAQ"
"ARCT","Arcturus Therapeutics Holdings Inc. Common Stock","NASDAQ"
"ARDX","Ardelyx Inc. Common Stock","NASDAQ"
"AREB","American Rebel Holdings Inc. Common Stock","NASDAQ"
"AREBW","American Rebel Holdings Inc. Warrants","NASDAQ"
"AREC","American Resources Corporation Class A Common Stock","NASDAQ"
"ARGX","argenx SE American Depositary Shares","NASDAQ"
"ARHS","Arhaus Inc. Class A Common Stock","NASDAQ"
"ARKO","ARKO Corp. Common Stock","NASDAQ"
"ARKOW","ARKO Corp. Warrant","NASDAQ"
"ARKR","Ark Restaurants Corp. Common Stock","NASDAQ"
"ARLP","Alliance Resource Partners L.P. Common Units representing Limited Partners Interests","NASDAQ"
"ARM","Arm Holdings plc American Depositary Shares","NASDAQ"
"AROW","Arrow Financial Corporation Common Stock","NASDAQ"
"ARQ","Arq Inc. Common Stock","NASDAQ"
"ARQQ","Arqit Quantum Inc. Ordinary Shares","NASDAQ"
"ARQQW","Arqit Quantum Inc. Warrants","NASDAQ"
"ARQT","Arcutis Biotherapeutics Inc. Common Stock","NASDAQ"
"ARRY","Array Technologies Inc. Common Stock","NASDAQ"
"ARTL","Artelo Biosciences Inc. Common Stock","NASDAQ"
"ARTNA","Artesian Resources Corporation Class A Common Stock","NASDAQ"
"ARTV","Artiva Biotherapeutics Inc. Common Stock","NASDAQ"
"ARTW","Art's-Way Manufacturing Co. Inc. Common Stock","NASDAQ"
"ARVN","Arvinas Inc. Common Stock","NASDAQ"
"ARWR","Arrowhead Pharmaceuticals Inc. Common Stock","NASDAQ"
"ASBP","Aspire Biopharma Holdings Inc. Common Stock","NASDAQ"
"ASBPW","Aspire Biopharma Holdings Inc. Warrant","NASDAQ"
"ASLE","AerSale Corporation Common Stock","NASDAQ"
"ASMB","Assembly Biosciences Inc. Common Stock","NASDAQ"
"ASML","ASML Holding N.V. New York Registry Shares","NASDAQ"
"ASND","Ascendis Pharma A/S American Depositary Shares","NASDAQ"
"ASNS","Actelis Networks Inc. Common Stock","NASDAQ"
"ASO","Academy Sports and Outdoors Inc. Common Stock","NASDAQ"
"ASPC","A SPAC III Acquisition Corp. Class A Ordinary Shares","NASDAQ"
"ASPCR","A SPAC III Acquisition Corp. Right","NASDAQ"
"ASPCU","A SPAC III Acquisition Corp. Unit","NASDAQ"
"ASPI","ASP Isotopes Inc. Common Stock","NASDAQ"
"ASPS","Altisource Portfolio Solutions S.A. Common Stock","NASDAQ"
"ASPSW","Altisource Portfolio Solutions S.A. Net Settle Stakeholder Warrants","NASDAQ"
"ASPSZ","Altisource Portfolio Solutions S.A. Cash Exercise Stakeholder Warrants","NASDAQ"
"ASRT","Assertio Holdings Inc. Common Stock","NASDAQ"
"ASRV","AmeriServ Financial Inc. Common Stock","NASDAQ"
"ASST","Strive Inc. Class A Common Stock","NASDAQ"
"ASTC","Astrotech Corporation (DE) Common Stock","NASDAQ"
"ASTE","Astec Industries Inc. Common Stock","NASDAQ"
"ASTH","Astrana Health Inc. Common Stock","NASDAQ"
"ASTI","Ascent Solar Technologies Inc. Common Stock","NASDAQ"
"ASTL","Algoma Steel Group Inc. Common Shares","NASDAQ"
"ASTLW","Algoma Steel Group Inc. Warrant","NASDAQ"
"ASTS","AST SpaceMobile Inc. Class A Common Stock","NASDAQ"
"ASUR","Asure Software Inc Common Stock","NASDAQ"
"ASYS","Amtech Systems Inc. Common Stock","NASDAQ"
"ATAI","ATAI Life Sciences N.V. Common Shares","NASDAQ"
"ATAT","Atour Lifestyle Holdings Limited American Depositary Shares","NASDAQ"
"ATEC","Alphatec Holdings Inc. Common Stock","NASDAQ"
"ATER","Aterian Inc. Common Stock","NASDAQ"
"ATEX","Anterix Inc. Common Stock","NASDAQ"
"ATGL","Alpha Technology Group Limited Class A Ordinary Shares","NASDAQ"
"ATHA","Athira Pharma Inc. Common Stock","NASDAQ"
"ATHE","Alterity Therapeutics Limited American Depositary Shares","NASDAQ"
"ATHR","Aether Holdings Inc. Common Stock","NASDAQ"
"ATII","Archimedes Tech SPAC Partners II Co. Ordinary Shares","NASDAQ"
"ATIIU","Archimedes Tech SPAC Partners II Co. Unit","NASDAQ"
"ATIIW","Archimedes Tech SPAC Partners II Co. Warrant","NASDAQ"
"ATLC","Atlanticus Holdings Corporation Common Stock","NASDAQ"
"ATLCL","Atlanticus Holdings Corporation 6.125% Senior Notes due 2026","NASDAQ"
"ATLCP","Atlanticus Holdings Corporation 7.625% Series B Cumulative Perpetual Preferred Stock no par value per share","NASDAQ"
"ATLCZ","Atlanticus Holdings Corporation 9.25% Senior Notes due 2029","NASDAQ"
"ATLN","Atlantic International Corp. Common Stock","NASDAQ"
"ATLO","Ames National Corporation Common Stock","NASDAQ"
"ATLX","Atlas Lithium Corporation Common Stock","NASDAQ"
"ATMC","AlphaTime Acquisition Corp Ordinary Shares","NASDAQ"
"ATMCR","AlphaTime Acquisition Corp Right","NASDAQ"
"ATMCU","AlphaTime Acquisition Corp Unit","NASDAQ"
"ATMCW","AlphaTime Acquisition Corp Warrant","NASDAQ"
"ATMV","AlphaVest Acquisition Corp Ordinary Shares","NASDAQ"
"ATMVR","AlphaVest Acquisition Corp Right.","NASDAQ"
"ATMVU","AlphaVest Acquisition Corp Unit","NASDAQ"
"ATNI","ATN International Inc. Common Stock","NASDAQ"
"ATOM","Atomera Incorporated Common Stock","NASDAQ"
"ATON","AlphaTON Capital Corp. Common Stock","NASDAQ"
"ATOS","Atossa Therapeutics Inc. Common Stock","NASDAQ"
"ATPC","Agape ATP Corporation Common Stock","NASDAQ"
"ATRA","Atara Biotherapeutics Inc. Common Stock","NASDAQ"
"ATRC","AtriCure Inc. Common Stock","NASDAQ"
"ATRO","Astronics Corporation Common Stock","NASDAQ"
"ATXG","Addentax Group Corp. Common Stock","NASDAQ"
"ATXS","Astria Therapeutics Inc. Common Stock","NASDAQ"
"ATYR","aTyr Pharma Inc. Common Stock","NASDAQ"
"AUBN","Auburn National Bancorporation Inc. Common Stock","NASDAQ"
"AUDC","AudioCodes Ltd. Common Stock","NASDAQ"
"AUGO","Aura Minerals Inc. Common Shares","NASDAQ"
"AUID","authID Inc. Common Stock","NASDAQ"
"AUPH","Aurinia Pharmaceuticals Inc Ordinary Shares","NASDAQ"
"AUR","Aurora Innovation Inc. Class A Common Stock","NASDAQ"
"AURA","Aura Biosciences Inc. Common Stock","NASDAQ"
"AUROW","Aurora Innovation Inc. Warrant","NASDAQ"
"AUTL","Autolus Therapeutics plc American Depositary Share","NASDAQ"
"AUUD","Auddia Inc. Common Stock","NASDAQ"
"AUUDW","Auddia Inc. Warrants","NASDAQ"
"AVAH","Aveanna Healthcare Holdings Inc. Common Stock","NASDAQ"
"AVAV","AeroVironment Inc. Common Stock","NASDAQ"
"AVBH","Avidbank Holdings Inc. Common stock","NASDAQ"
"AVBP","ArriVent BioPharma Inc. Common Stock","NASDAQ"
"AVDL","Avadel Pharmaceuticals plc Ordinary Share","NASDAQ"
"AVDX","AvidXchange Holdings Inc. Common Stock","NASDAQ"
"AVGO","Broadcom Inc. Common Stock","NASDAQ"
"AVIR","Atea Pharmaceuticals Inc. Common Stock","NASDAQ"
"AVNW","Aviat Networks Inc. Common Stock","NASDAQ"
"AVO","Mission Produce Inc. Common Stock","NASDAQ"
"AVPT","AvePoint Inc. Class A Common Stock","NASDAQ"
"AVR","Anteris Technologies Global Corp. Common Stock","NASDAQ"
"AVT","Avnet Inc. Common Stock","NASDAQ"
"AVTX","Avalo Therapeutics Inc. Common Stock","NASDAQ"
"AVXL","Anavex Life Sciences Corp. Common Stock","NASDAQ"
"AWRE","Aware Inc. Common Stock","NASDAQ"
"AXGN","Axogen Inc. Common Stock","NASDAQ"
"AXIN","Axiom Intelligence Acquisition Corp 1 Class A Ordinary Shares","NASDAQ"
"AXINR","Axiom Intelligence Acquisition Corp 1 Right","NASDAQ"
"AXINU","Axiom Intelligence Acquisition Corp 1 Units","NASDAQ"
"AXON","Axon Enterprise Inc. Common Stock","NASDAQ"
"AXSM","Axsome Therapeutics Inc. Common Stock","NASDAQ"
"AXTI","AXT Inc Common Stock","NASDAQ"
"AYTU","Aytu BioPharma Inc.  Common Stock","NASDAQ"
"AZ","A2Z Cust2Mate Solutions Corp. Common Shares","NASDAQ"
"AZI","Autozi Internet Technology (Global) Ltd. Class A Ordinary Shares","NASDAQ"
"AZN","AstraZeneca PLC American Depositary Shares","NASDAQ"
"AZTA","Azenta Inc.","NASDAQ"
"BACC","Blue Acquisition Corp. Class A Ordinary Shares","NASDAQ"
"BACCR","Blue Acquisition Corp. Right ","NASDAQ"
"BACCU","Blue Acquisition Corp. Unit","NASDAQ"
"BACQ","Bleichroeder Acquisition Corp. I Class A Ordinary Shares","NASDAQ"
"BACQR","Bleichroeder Acquisition Corp. I Right","NASDAQ"
"BAER","Bridger Aerospace Group Holdings Inc. Common Stock","NASDAQ"
"BAERW","Bridger Aerospace Group Holdings Inc. Warrant","NASDAQ"
"BAFN","BayFirst Financial Corp. Common Stock","NASDAQ"
"BAND","Bandwidth Inc. Class A Common Stock","NASDAQ"
"BANF","BancFirst Corporation Common Stock","NASDAQ"
"BANFP","BancFirst Corporation - BFC Capital Trust II Cumulative Trust Preferred Securities","NASDAQ"
"BANL","CBL International Limited Ordinary Shares","NASDAQ"
"BANR","Banner Corporation Common Stock","NASDAQ"
"BANX","ArrowMark Financial Corp. Common Stock","NASDAQ"
"BAOS","Baosheng Media Group Holdings Limited Ordinary shares","NASDAQ"
"BASE","Couchbase Inc. Common Stock","NASDAQ"
"BATRA","Atlanta Braves Holdings Inc. Series A Common Stock","NASDAQ"
"BATRK","Atlanta Braves Holdings Inc. Series C Common Stock","NASDAQ"
"BAYAR","Bayview Acquisition Corp Right","NASDAQ"
"BBCP","Concrete Pumping Holdings Inc. Common Stock","NASDAQ"
"BBGI","Beasley Broadcast Group Inc. Class A Common Stock","NASDAQ"
"BBIO","BridgeBio Pharma Inc. Common Stock","NASDAQ"
"BBLG","Bone Biologics Corp Common Stock","NASDAQ"
"BBLGW","Bone Biologics Corp Warrants","NASDAQ"
"BBNX","Beta Bionics Inc. Common Stock","NASDAQ"
"BBOT","BridgeBio Oncology Therapeutics Inc. Common Stock  ","NASDAQ"
"BBSI","Barrett Business Services Inc. Common Stock","NASDAQ"
"BCAB","BioAtla Inc. Common Stock","NASDAQ"
"BCAL","California BanCorp Common Stock","NASDAQ"
"BCAR","D. Boral ARC Acquisition I Corp. Class A Ordinary Shares","NASDAQ"
"BCARU","D. Boral ARC Acquisition I Corp. Units","NASDAQ"
"BCARW","D. Boral ARC Acquisition I Corp. Warrant","NASDAQ"
"BCAX","Bicara Therapeutics Inc. Common Stock","NASDAQ"
